neutral,"According to Gran , the company has no plans to move all production to Russia , although that is where the company is growing ."
neutral,"Technopolis plans to develop in stages an area of no less than 100,000 square meters in order to host companies working in computer technologies and telecommunications , the statement said ."
negative,"The international electronic industry company Elcoteq has laid off tens of employees from its Tallinn facility ; contrary to earlier layoffs the company contracted the ranks of its office workers , the daily Postimees reported ."
positive,"( ADP News ) - Feb 9 , 2009 - Finnish computer services company Proha Oyj ( HEL : ART1V ) said today its net loss narrowed to EUR 113,000 ( USD 146,000 ) for 2008 from EUR 1.2 million for 2007 ."
positive,The new factory working model and reorganisations would decrease Nokian Tyres ' costs in the factory by EUR 30 million ( USD 38.7 m ) .
positive,20 October 2010 - Finnish metal products company Componenta Oyj HEL : CTH1V said yesterday that its net loss narrowed to EUR7m for the first nine months of 2010 from EUR23 .3 m for the same period of 2009 .
positive,Finnish fibers and plastic products maker Suominen Corporation said its net loss narrowed to 1.6 mln euro $ 2.0 mln in the first nine months of 2006 from 2.16 mln euro $ 2.7 mln in the same period of 2005 .
positive,"In contrast , the company 's net loss for the third quarter of 2009 contracted to EUR 76 million from EUR 256 million for the corresponding period a year ago ."
positive,"In the second quarter of 2010 , Raute 's net loss narrowed to EUR 123,000 from EUR 1.5 million in the same period of 2009 ."
positive,"ADP News - Nov 13 , 2008 - Finnish printed circuit board PCB maker Aspocomp Group Oyj OMX : ACG1V said today that its net loss narrowed to EUR 2 million USD 2.5 m in the first nine months of 2008 from EUR 57"
positive,"Metsaliitto , however , narrowed its net loss for the second quarter of 2007 to 5.0 mln euro $ 6.9 mln from 61 mln euro $ 83.7 mln a year ago ."
positive,"narrows to EUR2 .8 m 9-mo '09 29 October 2009 - Finnish software and hardware developer Elektrobit Oyj HEL : EBG1V , or EB , said today that its net loss narrowed to EUR2 .8 m for the first nine months of 2009 from EUR35 .6 m for the same period a year ago ."
positive,The diluted loss per share narrowed to EUR 0.27 from EUR 0.86 .
positive,Unit costs for flight operations fell by 6.4 percent .
positive,The loss for the third quarter of 2007 was EUR 0.3 mn smaller than the loss of the second quarter of 2007 .
positive,Airvana 's UMTS Home Base Station femto cell uses software-based functionality and off-the-shelf silicon to accelerate feature development and reduce product cost .
positive,"According to Sepp+Ænen , the new technology UMTS900 solution network building costs are by one-third lower than that of the building of 3.5 G networks , operating at 2,100 MHz frequency ."
positive,The costs of the new ropax vessels are 30 % lower than those of the present ones .
neutral,The last job losses related to these reductions will take place during 2010 .
positive,The program 's target is structural cost reductions of about EUR 30mn in 2009 .
neutral,"The third quarter result also includes a 400,000 euro ( $ 575,000 ) provision for down-sizing of lure manufacturing in Ireland ."
positive,UPM-Kymmene is working closely with its shipping agents to reduce fuel consumption and greenhouse gas emissions .
negative,"2009 3 February 2010 - Finland-based steel maker Rautaruukki Oyj ( HEL : RTRKS ) , or Ruukki , said today it slipped to a larger-than-expected pretax loss of EUR46m in the fourth quarter of 2009 from a year-earlier profit of EUR45m ."
negative,"( ADPnews ) - Feb 3 , 2010 - Finland-based steel maker Rautaruukki Oyj ( HEL : RTRKS ) , or Ruukki , said today it slipped to a larger-than-expected pretax loss of EUR 46 million ( USD 64.5 m ) in the fourth quarter of 2009 from a"
negative,"Result before taxes decreased to nearly EUR 14.5 mn , compared to nearly EUR 20mn in the previous accounting period ."
negative,The company slipped to an operating loss of EUR 2.6 million from a profit of EUR 1.3 million .
negative,23 April 2010 - Finnish construction and engineering company Outotec Oyj HEL : OTE1V said today it slipped to a net loss of EUR7 .3 m in the first quarter of 2010 from a net profit of EUR12 .5 m in the corresponding period last year .
negative,Cramo slipped to a pretax loss of EUR 6.7 million from a pretax profit of EUR 58.9 million .
negative,"Finnish IT solutions provider Affecto Oyj HEL : AFE1V said today its slipped to a net loss of EUR 115,000 USD 152,000 in the second quarter of 2010 from a profit of EUR 845,000 in the corresponding period a year earlier ."
negative,"In 2009 , Comptel slipped to a net loss of EUR2 .1 m from a profit of EUR6 .6 m in the previous year ."
negative,"In Q2 of 2009 , profit before taxes amounted to EUR 13.6 mn , down from EUR 26.8 mn in Q2 of 2008 ."
negative,"ADPnews - Feb 5 , 2010 - Finnish real estate investor Sponda Oyj HEL : SDA1V said today that it slipped to a net loss of EUR 81.5 million USD 11.8 m in 2009 from a profit of EUR 29.3 million in 2008 ."
negative,"ADPnews - Jul 17 , 2009 - Finland-based steel maker Rautaruukki Oyj Ruukki HEL : RTRKS said today it slipped to a net loss of EUR 184 million USD 259.7 m for the first half of 2009 from a net profit of EUR 2"
negative,"Profit before taxes amounted to EUR 56.5 mn , down from EUR 232.9 mn a year ago ."
negative,"Profit before taxes decreased by 9 % to EUR 187.8 mn in the first nine months of 2008 , compared to EUR 207.1 mn a year earlier ."
negative,Profit before taxes decreased to EUR 31.6 mn from EUR 50.0 mn the year before .
negative,"Profit before taxes was EUR 4.0 mn , down from EUR 4.9 mn ."
negative,"The company 's profit before taxes fell to EUR 21.1 mn in the third quarter of 2008 , compared to EUR 35.8 mn in the corresponding period in 2007 ."
neutral,"A state program has been worked out , legal provisions have been developed , and rules and normative documents have been specified for the functioning of a technological park ."
positive,"In August-October 2010 , the company 's result before taxes totalled EUR 9.6 mn , up from EUR 0.5 mn in the corresponding period in 2009 ."
positive,Finnish Bore that is owned by the Rettig family has grown recently through the acquisition of smaller shipping companies .
positive,The plan is estimated to generate some EUR 5 million ( USD 6.5 m ) in cost savings on an annual basis .
positive,"Finnish pharmaceuticals company Orion reports profit before taxes of EUR 70.0 mn in the third quarter of 2010 , up from EUR 54.9 mn in the corresponding period in 2009 ."
positive,"Finnish Sampo Bank , of Danish Danske Bank group , reports profit before taxes of EUR 152.3 mn in 2010 , up from EUR 32.7 mn in 2009 ."
positive,"Profit after taxes for the period was up to EUR0 .9 m , from EUR0 .01 m last year ."
positive,"Profit before taxes was EUR 5.4 mn , up from EUR 3.6 mn a year earlier ."
negative,Also construction expenses have gone up in Russia .
neutral,"Neste Oil said it will build a biodiesel production facility in Rotterdam , the Netherlands , at an estimated cost of 670 million euros , naming France-based Technip as the project 's main contractor ."
neutral,The European Central Bank ECB is anticipated to raise its benchmark interest rate in the second half of 2011 at the earliest .
negative,11 August 2010 - Finnish measuring equipment maker Vaisala Oyj HEL : VAIAS said today that its net loss widened to EUR4 .8 m in the first half of 2010 from EUR2 .3 m in the corresponding period a year earlier .
negative,"Finnish power supply solutions and systems provider Efore Oyj said its net loss widened to 3.2 mln euro $ 4.2 mln for the first quarter of fiscal 2006-2007 ending October 31 , 2007 from 900,000 euro $ 1.2 mln for the same period of fiscal 2005-06 ."
negative,"ADP News - Apr 22 , 2009 - Finnish business information systems developer Solteq Oyj HEL : STQ1V said today its net loss widened to EUR 189,000 USD 245,000 for the first quarter of 2009 from EUR 10,000 for the same peri"
negative,Salonen added that data shows producers ' pulp inventories in North America are declining . '
negative,The Elcoteq group recently announced that the last three months of the previous year brought to it a major loss of more than half a billion kroons ( EUR 32 mln ) for the fifth quarter running .
positive,"For the current year , Raute expects its net sales to increase and the operating result -- to be positive ."
positive,"Turnover surged to EUR61 .8 m from EUR47 .6 m due to increasing service demand , especially in the third quarter , and the overall growth of its business ."
positive,"As a result , the company currently anticipates net sales to increase and the operating result to be positive ."
positive,"Asimilar agreement was signed between China Mobile Ltd. ( SEHK : 0941 and NYSE : CHL ) , the largest mobile carrier , and theGPS and social networking service provider , promoting GyPSii service before Beijing 2008 Olympic Games , according to thelatest news ."
positive,"`` UPM 's deliveries increased during the third quarter by 4 percent , and the efficiency of operations improved , '' Chief Executive Jussi Pesonen said ."
positive,"Global sports equipment maker Amer Sports Corp. , whose brands include Atomic , Salomon and Wilson , saw a 64 percent increase in third-quarter net profit to EURO 47.4 million $ 65 million on strong sales and cost cuts ."
neutral,"Exports make up more than 80 per cent of our sales , so the name Glaston also reflects a truly internationally operating company , '' explains Kyro 's President & CEO Mika Seitovirta ."
neutral,"Westend ICT Plc s new 409,665,891 shares and increase of share capital with EUR 2,000,000 based on the resolutions of extraordinary shareholders meeting on 27 December 2010 have today registered in the Trade Register ."
positive,"Due to rapid expansion , the market share of Tallink in terms of passenger carriage through Tallinna Sadam Port of Tallinn totaled 55 percent in November against 45.7 percent in November 2005 ."
positive,"Finnish industrial investor Panostaja Oyj OMX Helsinki : PNAAS OMX Helsinki : PNABS said on Friday 11 July that it has signed a deal to acquire the entire share capital of Kospa Oy , the manufacturer of waste disposal equipment ."
positive,"Stora Enso R shares rose 1.20 pct to 11.84 eur , UPM-Kymmene was also dragged higher , rising 1.68 pct to 17.56 eur and M-Real B added 2.38 pct to 4.30 eur ."
negative,Cash Flow from Operations for the most recent quarter also reached a eight year low .
positive,Both loans will be used to finance strategic investments such as shopping center redevelopment projects and refinancing of maturing debt .
positive,"The stock price rose 70.0 ores or 0.9 % to close at SEK77 .65 , ending a two-day streak of losses ."
positive,"Earnings per share ( EPS ) amounted to EUR0 .98 , up from the loss of EUR0 .02 ."
positive,"Earnings per share ( EPS ) were EUR0 .03 , up from the loss of EUR0 .083 ."
positive,"Operating profit totalled EUR 0.4 mn , up from an operating loss of EUR 0.8 mn year-on-year ."
positive,"Operating profit totalled EUR 7.0 mn , up from a loss of EUR 4.0 mn in the second quarter of 2009 ."
positive,Operating result including non-recurring items rose to EUR 146mn from a loss of EUR 267mn in 2009 .
positive,"Tiimari , the Finnish retailer , reported to have geenrated quarterly revenues totalling EUR 1.3 mn in the 4th quarter 2009 , up from EUR 0.3 mn loss in 2008 ."
positive,"Earnings per share EPS amounted to EUR0 .03 , up from the loss of EUR0 .08 ."
positive,"Operating profit totalled EUR 5.8 mn , up from a loss of EUR 1.7 mn in the fourth quarter of 2009 ."
positive,"Operating profit was EUR 0.6 mn , up from a loss of EUR 19mn a year earlier ."
positive,The investments and operational changes enable additional optimisation of the working hours and thereby further cost savings of some 7 % -9 % .
positive,"Okmetic 's products are based on high-tech expertise that generates added value for customers , innovative product development and an extremely efficient production process ."
neutral,"Shareholder 's full name and ID code : - Petri Ailus , born 15.9.1966 For further information , please contact Isto Hantila , CEO , tel. +358 9 591 8342 ."
positive,"9 September 2010 - Finnish stationery and gift retailer Tiimari HEL : TII1V said today its net sales rose by 2 % year-on-year to EUR5 .7 m in August 2010 , driven by growth in Finland , while demand in the Baltics remained weak ."
positive,"By 14:29 CET on Monday , shares in Bavarian Nordic had climbed 1.21 % to DKK250 on the stock exchange in Copenhagen after having lost 7.41 % in the past month ."
positive,"For example , net sales increased by 5.9 % from the first quarter , and EBITDA increased from a negative EUR 0.2 mn in the first quarter of 2009 ."
positive,"Mobile phone sales rose 25 % to 5.87 billion euros , while enterprise solution sales dropped 39 % to 186 million euros ."
negative,RISING costs have forced packaging producer Huhtamaki to axe 90 jobs at its Hampshire manufacturing plant .
negative,"`` However , the rapidly increasing costs and the strengthening of the euro were challenging for the whole industry , and they impacted on our results . ''"
negative,"At this growth rate , paying off the national debt will be extremely painful ."
negative,Operating loss increased to EUR 17mn from a loss of EUR 10.8 mn in 2005 .
negative,"The payment of 2.779 million litas in interest on a long-term loan provided by Ragutis ' majority shareholder , Estonia 's A. Le Coq , also added to the losses ."
negative,"At the moment , Valio is not worried , but if the ban continues for long , it may become quite a problem ."
neutral,"RK Group , headquartered in Vantaa , Finland , is one of Europe 's leading machinery rental services ."
positive,"Russia 's top container shipping group , Fesco , and Finnish logistics company Nurminen Logistics have started a pilot project offering clients direct intermodal transportation service from Finland to Asia Pacific countries , Fesco said in a statement ."
neutral,`` Social networking and location-based service trends comprise a significant share of the Internet traffic today and are appealing to MID users .
positive,"`` The acquisition of Sampo Bank makes strategic sense for DB , '' says Lindsey Liddell , director of Fitch Ratings 's Financial Institutions Group ."
neutral,"`` The bond gathered subscriptions from some 400 investors and the issued amount can be considered substantial taking into account the main target group -- retail investors , '' Citycon CFO Eero Sihvonen said ."
positive,`` The CHF is a great product .
neutral,`` The flex is a small price to pay for happy lenders . ''
neutral,"`` The industry is coming to an interesting fork in the road as both handset manufacturers and wireless carriers attempt to serve as the portal for Web-based service to your wireless handset , '' he wrote ."
positive,"`` The Intel Atom processor has had tremendous success in the marketplace since its launch over 2 years ago , '' said Pankaj Kedia , director of global ecosystem programs for Intel Corp. 's Ultra Mobility Group ."
neutral,"`` Tom Doring has a long and successful career in the drives business , and he knows the American market ."
positive,"`` We have significant experience in smartphone functionality , in the development of mobile Internet services , and in uniting the two into a smooth user experience ."
neutral,`` With this new version it is very important for us to introduce a BIM process that is based on the detailed building information model .
neutral,18:30 Dinner The conference program can also be viewed as a live audio webcast through the internet pages at www.citycon.com .
neutral,"3G data subscribers are also helping to maintain these growth levels , since data-only subscriptions push for more multiple SIM ownership ."
neutral,6 October 2010 - Finnish paints and coatings company Tikkurila Oyj HEL : TIK1V announced today the launch of Tikkurila ProHouse method for protection of wooden surfaces via treatment with Ultra Pro waterborne products .
neutral,A CUT ABOVE Bring the outdoors in with these birch-branch coasters .
neutral,"A downloadable instruction sheet , instructional video , and project ideas for the award-winning Everywhere Punch TM Window System can be found at www.fiskars.com ."
positive,A new Kveyt light variety of Suomalainen Pekoni marketed under the Atria brand name is now available to consumers in Finland .
neutral,A PLUMBING business has announced it is sponsoring a professional darts player .
positive,A realignment of interests in the sector is clearly under way .
neutral,"A. Le Coq Special was developed for the bicentenary of the company and the trade mark , the brewer said ."
neutral,Estimations indicate that even up to 170 different tablet computers or reading devices will be available in 2011 .
positive,"Finnish construction company YIT Corporation is planning to build about 200 high-quality holiday homes near the Tahko ski and spa resort , in Finland ."
neutral,"After piloting , the instrument will be further developed according to the experiences gained ."
neutral,"And when it has lifted the veil on the various types of customer for which it designs its phones , the result is social stereotyping taken to a fine art ."
neutral,Another noticeable thing is that the search for Tata and Airtel brands was mostly related to ` broadband connections ' .
neutral,As an overall effect of the above-mentioned measures Glaston will recognize non-recurring expenses of EUR 12 million in the fourth quarter of 2008 .
neutral,Aspo has also investigated the sales opportunities of Kaukomarkkinat 's electronics business .
positive,"At a press conference , Lattelecom board chairman Nils Melngailis explained that Blackstone had been chosen for its experience in the IT sector as well as its financial strength ."
neutral,"At the beginning of the subscription period on May 2 , 2006 the share subscription price under B option right is EUR 10.22 per share ."
neutral,"Back then , Tikkurila 's former owner , Finnish chemicals company Kemira Oyj HEL : KRA1V , distributed an 86 % stake to Kemira shareholders to facilitate the divestment and listing of Tikkurila ."
neutral,"Based on negotiations with personnel , some 20 % have indicated their willingness to move to the new location ."
neutral,BG Crane has a strong customer base in the on-road load handling and related installation and service businesses .
neutral,Both Mr Walden and Mr Ignatius will be responsible also for the newspapers ' business result .
neutral,Capitex Kalmar will continue to be responsible for the maintenance and technical development of the services .
neutral,"Cathay Forest 's strategy is to develop sustainable , regenerative forest assets ."
neutral,Changes to the as-built models from the design were communicated to the subcontractors to accommodate them into the steel and GRC glass reinforced concrete fabrication process .
neutral,"Chargers manufactured under the new platform are suitable for mobile phones , navigators , digital cameras , Bluetooth head sets , media players and other electronic devices ."
positive,"com , and we are constantly planning new ways to serve our customers online on a more comprehensive basis , '' says Matti Leminen , President of Anttila Oy ."
neutral,"Currently , YIT builds a housing estate Zapadnye Vorota 26,000 square metres in the city and a house 9,910 square metres , which will be completed at the end of 2009 ."
neutral,Customers in a wide range of industries use our stainless steel and services worldwide .
neutral,Delivery will start immediately in June 2008 and will be completed in 2008 .
neutral,"Demonstrations of the broad capabilities of the Mobility Business Suite will be organized during the 3GSM World Congress in Barcelona , from February 12th to 15th ."
neutral,Each option right entitles the holder to subscribe for one new share at a subscription price of EUR0 .045 during the subscription period which ends on 31 December 2013 .
neutral,Elisa will expand the use of this technology provided the pilot proves successful .
neutral,"Elite Residence Tower , a new development by Tameer , is located at the heart of Dubai Marina ."
neutral,Europe needs 17 new large paper machines .
neutral,Exel wants to serve its industrial customers with individual products .
neutral,"Finnish bank Pohjola Bank Plc HEL : POH1S said today that it will issue a EUR 40 million USD 51.2 m index-linked bond , Pohjola Tutkimuksen Tahdet VIII-2010 Pohjola Research Stars VIII-2010 , on October 27 , 2010 ."
neutral,"Finnish diversified holding company Aspo Oyj said on September 8 , 2008 that it will sell the Finnish tape business of its Kaukomarkkinat unit to local Oy Telpak Ab ."
positive,"Finnish retailer Stockmann has won approval from the board of Swedish rival Lindex for a public tender offer with the aim of expanding the companies ' presence in Russia and other CEE countries , Stockmann said Monday ."
negative,"Finnish software and hardware developer Elektrobit Oyj HEL : EBG1V , or EB , said today it will temporarily lay off up to 200 people for a maximum of 90 day in Finland , aiming to achieve cost savings of EUR 1.7 million USD 2m in the second half of 2010 ."
neutral,"Following the impact , the Altima hit a utility pole , causing a live electric line to fall onto the roadway ."
neutral,From Merisatama to the far corners of the world Asfaltti Osakeyhti+?Lemmink+Æinen was established in 1910 by a group of master builders in Helsinki as a specialist business and subcontractor .
neutral,"F-Secure , a developer of security solutions as a service through Internet Service Providers and mobile operators , announced results from its annual Online Wellbeing Survey ."
neutral,"Further concrete cooperation is also carried out through various projects , doctoral theses and diploma dissertations ."
neutral,"Furthermore , the company will sell the warehouse and office buildings in Loudeac and Saint Marcel and lease new joint premises for these operations in Morvillars ."
neutral,"The transaction , which includes US$ 1.5 billion euro1 billion in cash , vendor notes and share purchases , is expected to be completed in the first quarter of 2008 , the Finnish-Swedish paper maker said ."
neutral,The upgraded factory is scheduled to come on stream in the summer of 2008 .
neutral,The uranium found locally is naturally occurring and it makes sense to extract it in the same way as we do with our other metals . ''
positive,"There are companies , which are ready to invest their own funds in this deal such as Rostelecom RTS : RTKM ."
neutral,"They are responsible for their own operations , customer relationships , and the development of these ."
neutral,This allows devices such as mobile phones to become a few millimetres thinner .
neutral,"This implementation is very important to the operator , since it is about to launch its Fixed-to-Mobile convergence service in Brazil see Brazil : 8 May 2006 : ."
positive,This is the first time Finnair has been awarded an agreement with the UK government .
neutral,This organization will assume the responsibility for operations in Russia .
neutral,This PC application allows users to copy files and other data from their Nokia mobile device to their computer as well as create backup content .
neutral,Three students from Universiti Sains Malaysia have won a study trip to Helsinki .
neutral,"Thus the group 's balance sheet will have about EUR 25.8 million of goodwill , the company added ."
neutral,"Thus the group 's balance sheet will have about EUR25 .8 m in goodwill for 2010 , the company added ."
neutral,Timo Penttila has been appointed new manager responsible for the asset management of Nordea 's institutional customers in Finland .
neutral,"To achieve synergy targets related to the acquisition , Vaisala is consolidating its manufacturing , depot and data services , and finance activities currently located in Uniontown , Pennsylvania , St. Louis , Missouri and Durham , North Carolina ."
neutral,To raise consumer awareness and encourage people to recycle their old mobile devices Nokia runs regular recycling campaigns around the world .
neutral,"To see more of New Haven Register , or to subscribe to the newspaper ."
neutral,"To showcase our end-to-end capabilities at the Mobile World Congress , we arranged an internal MeeGo application development competition to entice developers to create new applications ."
neutral,"Today , we are connecting people in new and different ways - fusing advanced mobile technology with personalized services to enable people to stay close to what matters to them ."
neutral,Together they generate Aspo 's goodwill .
neutral,"Trading in the new shares , which have right to dividends and other distributions of funds , will start on the exchange in Helsinki tomorrow ."
neutral,UNC Charlotte would also deploy SSH Tectia Connector to enable secure application connectivity .
positive,UPM-Kymmene has generated four consecutive quarters of positive Free Cash Flow .
positive,UPM-Kymmene has generated seventeen consecutive quarters of positive Cash Flow from Operations .
positive,UPM-Kymmene has generated thirty-one consecutive quarters of positive EBITDA .
neutral,"UPM-Kymmene www.upm-kymmene.com produces magazine papers and newsprint , as well as fine and specialty papers , converting materials and wood products ."
neutral,"Wayne Greensmith , Fiskars Brands UK senior brand manager , said : `` We have launched this as we want to give something back to the community ."
