positive,"VDW combined with LXE devices enhances productivity , enabling workers to use a single device to perform voice , scanning and keyboard functions ."
positive,"We can choose the most efficient , best overall value option for our customers already at the bidding stage ."
neutral,We make available the following brand-new market analyses : Cement - UK Cement - Poland Cement - Belgium These analyses give a clear overview of the actual situation and future outlook of the cement industry in some European countries .
neutral,We make available the following brand-new market analyses Cement - Pakistan Cement - Malaysia Cement - Taiwan Cement - Philippines These analyses give a clear overview of the actual situation and future outlook of the cement industry in some Asian countries .
neutral,"We serve a broad range of customers , including construction and process industries , shipyards , the public sector and households ."
neutral,"We went to the market with yield guidance of the 7.25 % area , which gave us the flexibility to go up or down by 1-8th ."
neutral,"Vehvilainen , who is currently the chief operating officer at Nokia Siemens Networks , will join Finnair on 5 January 2010 and take over as CEO effective 1 February 2010 ."
neutral,"When new types of network elements are added to the network , the conversion file is updated by adding the information required for converting the message format of the new network element type to the format understood by the management system ."
positive,"When open next year , it will be the largest facility in the world to produce diesel fuel from renewable feedstock such as palm oil and animal fat ."
neutral,"Via the plant , the Belgian company will feed 8.4 MW of electricity into the distribution grid and will be able to deliver up to 14 MW of heat ."
positive,Viking Line head Jan Kaarstroem told TT that his company 's ferries were well equipped to handle ice and that all the passengers were safe .
neutral,"Yara Suomi Ltd also provides nitrogen chemicals and technical nitrates to various sectors of industry , as well as products used in environmental protection ."
neutral,Finnish plumbing and heating systems supplier Uponor announced a company-wide cost reduction program in August 2008 .
positive,Finnish plumbing and heating systems supplier Uponor Corporation ( OMX Helsinki : UNR1V ) said on Tuesday ( 12 August ) that its board of directors has authorised the management to proceed with a company-wide cost reduction program .
neutral,"A Flurry Analytics spokesperson said that , as it was only measuring Windows Phone 7 data for some weeks , the firm double-checked the data to make sure the 66 per cent rise was not an aberration ."
negative,"Net sales of Finnish Sanoma Learning & Literature , of Finnish media group Sanoma , decreased by 3.6 % in January-June 2009 totalling EUR 162.8 mn , down from EUR 168.8 mn in the corresponding period in 2008 ."
negative,"Employing 112 in Finland and 280 abroad , the unit recorded first-quarter 2007 sales of 8.6 mln eur , with an operating loss of 1.6 mln eur ."
negative,"JP Morgan expects that Scala will lower Nobel Biocare 's growth forecast for 2007 from the current guidance of 23-25 pct , as well as the operating margin target from the current 34-35 pct ."
negative,"Furthermore , sales of new passenger cars and light commercial vehicles in the country declined by 5.4 % year-on-year last month ."
negative,"IT services firm TietoEnator was bucking the general trend , holding flat at 22.70 eur , after slipping back from earlier gains ."
negative,"Profitability ( EBIT % ) was 13.6 % , compared to 14.3 % in Q2 2009 ."
negative,"Several large stocks tacked lower , however ."
positive,"The company booked April-June new orders worth 949 mln eur , compared with 786 mln eur in the same period a year ago ."
negative,Sales of mid-strength beer decreased by 40 % .
negative,"TeliaSonera 's underlying results however included 457 mln skr in positive one-offs , hence the adjusted underlying EBITDA actually amounts to 7.309 bln skr , clearly below expectations , analysts said ."
positive,Aspocomp has repaid its interest bearing liability to Standard Chartered Bank and will use the rest of the consideration to partially repay its interest bearing liabilities in Finland and to improve its liquidity .
positive,"Mika Stahlberg , VP F-Secure Labs , said , `` We are excited and proud that F-Secure has been recognized by AV-Comparatives as the Product of the Year ."
positive,"The Ministry of Water in Tanzania has awarded Poyry a water and sanitation engineering assignment for the rehabilitation and extension of water supply and sanitation infrastructure in Bukoba and Musoma , situated at Lake Victoria in northern Tanzania ."
positive,The policy was also aimed at making the companies more profitable and competitive .
positive,"The three year turn-around program is expected to ensure Salomon 's future competitiveness , the company said ."
positive,"We are very pleased with the fine co-operation between the two countries in recent times , he said ."
positive,"Finland 's leading metals group Outokumpu said its fourth-quarter net profit more than tripled on the back of strong global demand for stainless steel , soaring base metal prices and proceeds from the sale of its technology unit ."
neutral,"Neste Oil Corporation is a refining and marketing company concentrating on clean , high-quality traffic fuels ."
neutral,"Aug. 31 , 2009 (Gawker Media delivered by Newstex)-- If you love fishing video games but felt that there just was n't enough wackiness involved , then Activision 's (NASDAQ : ATVI) Rapala : We Fish might just catch your eye with its family-fun hook ."
neutral,"The company has the poser , who wants to impress people with the latest handset ."
positive,"`` We are delighted to announce our support for Intel based handheld platforms , the capabilities of which have made our development easier and faster ."
positive,"According to Bosse , the present cooperation is beneficial to all parties , however ."
positive,`` We are proud to contribute to the creation of a world-class airport facility with KONE 's innovative People Flow TM solutions .
negative,Finnish insurance company Fennia and Kesko Group are ending their loyal customer cooperation .
neutral,According to an  posted by the World Intellectual Property Organization : `` The present invention relates to hydrocarbons and particularly to the manufacture of hydrocarbon components suitable as aviation fuels or jet fuels and as blending stocks for aviation fuels .
neutral,And that 's exactly what happened on a recent weekday when an East Haven baker was brought in to remind residents about the Easter tradition of making wheat and rice pies .
neutral,Any investment or investment activity to which this communication relates is only available to relevant persons and will be engaged in only with relevant persons .
positive,"Efore 's presence here also opens up new and interesting development opportunities for our students , '' the dean of the Faculty of Electronics , Communications and Automation at TKK said ."
positive,"`` Indo-Russia trade can cross the targeted 10 billion dollars by 2010 and double to 20 billion dollars by 2015 , if trade irritants and procedural hassles are resolved , '' the chamber said in its survey on obstacles to trade with Russia ."
positive,"`` This is a significant milestone for Benefon , helping us to secure critical USP 's for our personal navigation product roadmap for 2007 and beyond , '' commented Simon Button , Chief Technology Officer at Benefon ."
positive,"18 May 2010 - Finnish electronics producer Elcoteq SE HEL : ELQAV said today that it has signed an extensive cooperation agreement on industrialisation , manufacturing , distribution and after-market services for mobile phones with Japan 's Sharp TYO : 6753 ."
positive,"Investors will continue being interested in the company 's share although it is not quite cheap , Affarsvarlden said ."
neutral,"Swedish telco TeliaSonera is teaming up with Friends , a Swedish organization against bullying , to fight bullying of children and teenagers via electronic channels ."
neutral,"`` Each year , personal entertainment plays a more significant role in determining whether a fitness facility 's workout experience is pleasurable or a chore , '' said Brian Wilson , director of marketing for Precor 's Entertainment & Services Division ."
neutral,`` I see my new post as an inspiring challenge .
neutral,"`` We will continue to make it easier for users to explore services on their handsets and will work towards bringing Internet to a wider range of devices including mid and low-end devices , '' said Kallasvuo ."
neutral,Finland 's dominating rail company VR is planning to set the infected passengers for long-distance trip in a separate carriage .
positive,"In complying with the European Water Framework Directive requirements , the pre-treatment unit will be fully renovated , including hydraulics of waste water inception , degridding , sand and grease removal and treatment and deodorization of the unit ."
neutral,Our purchase to pay solutions enable companies to gain visibility and control over business-critical financial processes .
positive,"So far , Mr. Galvan he has been able to avoid laying off workers ."
neutral,The agreement must be approved by the Russian competition authorities before it enters into force .
neutral,The total amount of subscription prices was recorded in the fund for invested non-restricted equity .
negative,"`` This is super nasty , '' said Eric Schultze , chief technology officer at Shavlik Technologies LLC , a St. Paul , Minn.-based maker of patch management tools ."
neutral,"Before Kemira 's installation NordAlu was producing 3,500 tons of liquid and solid aluminum waste per year ."
neutral,"He announced a `` solutions unit '' to speed co-operation in August , and shifted Simonson from finance chief to low-end phones in October ."
neutral,"It started with software that was capable of retrieving the data typed into the computer keyboard ( `` keyloggers '' ) , and then more complex mechanisms arrived on the scene , such as phishing and pharming ."
negative,More than a third of the original participants dropped out due to nausea and other side effects .
neutral,Mr Skogster currently serves as the manager responsible for ABB Oy 's system modules for low voltage drives .
neutral,"The Finnish company sold its UK operation - consisting of 50 staff in offices in London , Birmingham and Manchester - as part of a deal with Hampden in July 2001 for its European-wide property and casualty arm Sampo Industrial ."
positive,The StoneGate UTM solution offers protection against inbound and outbound attacks .
neutral,- Counter your competitor 's strengths and target their weaknesses .
neutral,An appeal concerning the project has been lodged at the Czech Ministry of the Environment .
negative,Aspocomp has a large factory in China and a factory building project in India that was halted due to financing problems .
negative,The repurchases shall decrease the distributable capital and reserves .
negative,- Net sales for the period are expected to fall well below that of last year and the result after non-recurring items is expected to be in the red .
negative,Diluted earnings per share ( EPS ) declined to EUR 0.78 from EUR 1.76 .
negative,Diluted earnings per share ( EPS ) fell to EUR 0.63 from EUR 1.71 .
negative,down to EUR5 .9 m H1 '09 3 August 2009 - Finnish media group Ilkka-Yhtyma Oyj ( HEL : ILK2S ) said today its net profit fell 45 % on the year to EUR5 .9 m in the first half of 2009 .
negative,Export declined by 6 percent to 16.4 million liters .
negative,"Exports of goods fell by 59 % , and imports by 16.7 % ."
negative,Finnish developer and manufacturer of mobile phone chargers Salcomp Plc OMX Helsinki : SAL1V on Wednesday 19 November lowered its full-year net sales estimate .
negative,Finnish investment group Norvestia Oyj said its net profit fell to 23.5 mln euro $ 30.6 mln in 2006 from 33.5 mln euro $ 43.6 mln in 2005 .
negative,LONDON MarketWatch -- Share prices ended lower in London Monday as a rebound in bank stocks failed to offset broader weakness for the FTSE 100 .
neutral,"Rinkuskiai 's beer sales fell by 6.5 per cent to 4.16 million litres , while Kauno Alus ' beer sales jumped by 6.9 per cent to 2.48 million litres ."
negative,"Operating profit fell to EUR 35.4 mn from EUR 68.8 mn in 2007 , including vessel sales gain of EUR 12.3 mn ."
negative,"Net sales of the Paper segment decreased to EUR 221.6 mn in the second quarter of 2009 from EUR 241.1 mn in the second quarter of 2008 , while operating profit excluding non-recurring items rose to EUR 8.0 mn from EUR 7.6 mn ."
negative,"Sales in Finland decreased by 10.5 % in January , while sales outside Finland dropped by 17 % ."
